{
  "$defs": {
    "GeneratedSectionDraft": {
      "additionalProperties": false,
      "description": "Deterministic placeholder from a prose adapter, never polished prose.",
      "properties": {
        "claim_ids": {
          "items": {
            "type": "string"
          },
          "title": "Claim Ids",
          "type": "array"
        },
        "content": {
          "minLength": 1,
          "title": "Content",
          "type": "string"
        },
        "fake": {
          "default": true,
          "title": "Fake",
          "type": "boolean"
        },
        "is_verification_evidence": {
          "default": false,
          "title": "Is Verification Evidence",
          "type": "boolean"
        },
        "polished": {
          "default": false,
          "title": "Polished",
          "type": "boolean"
        },
        "section_id": {
          "minLength": 1,
          "title": "Section Id",
          "type": "string"
        },
        "title": {
          "minLength": 1,
          "title": "Title",
          "type": "string"
        },
        "unsupported_sentences": {
          "items": {
            "type": "string"
          },
          "title": "Unsupported Sentences",
          "type": "array"
        },
        "used_citation_ids": {
          "items": {
            "type": "string"
          },
          "title": "Used Citation Ids",
          "type": "array"
        },
        "used_citation_keys": {
          "items": {
            "type": "string"
          },
          "title": "Used Citation Keys",
          "type": "array"
        },
        "used_claim_ids": {
          "items": {
            "type": "string"
          },
          "title": "Used Claim Ids",
          "type": "array"
        },
        "used_evidence_artifact_ids": {
          "items": {
            "type": "string"
          },
          "title": "Used Evidence Artifact Ids",
          "type": "array"
        },
        "warnings": {
          "items": {
            "type": "string"
          },
          "title": "Warnings",
          "type": "array"
        }
      },
      "required": [
        "section_id",
        "title",
        "content"
      ],
      "title": "GeneratedSectionDraft",
      "type": "object"
    }
  },
  "$id": "https://schemas.factori.local/0.48.0/prose-generation-parse-result.schema.json",
  "$schema": "https://json-schema.org/draft/2020-12/schema",
  "additionalProperties": false,
  "description": "Parsed one-section prose generation response.",
  "properties": {
    "fake": {
      "default": false,
      "title": "Fake",
      "type": "boolean"
    },
    "is_verification_evidence": {
      "default": false,
      "title": "Is Verification Evidence",
      "type": "boolean"
    },
    "raw_response_type": {
      "minLength": 1,
      "title": "Raw Response Type",
      "type": "string"
    },
    "reasons": {
      "items": {
        "type": "string"
      },
      "title": "Reasons",
      "type": "array"
    },
    "rejected": {
      "default": false,
      "title": "Rejected",
      "type": "boolean"
    },
    "section_draft": {
      "anyOf": [
        {
          "$ref": "#/$defs/GeneratedSectionDraft"
        },
        {
          "type": "null"
        }
      ],
      "default": null
    }
  },
  "required": [
    "raw_response_type"
  ],
  "title": "ProseGenerationParseResult",
  "type": "object",
  "x-factori-protocol-version": "0.48.0",
  "x-factori-source-model": "factori.schemas.ProseGenerationParseResult",
  "x-factori-verification-evidence": false
}
